{"$defs":{"AbsentContentObservation":{"additionalProperties":false,"description":"No byte digest: the file is absent, not regular, too large, unreadable, or kept changing.","properties":{"content_digest":{"title":"Content Digest","type":"null"},"observed_at":{"$ref":"#/$defs/ObservedAt"},"path_digest":{"$ref":"#/$defs/Digest"},"presence":{"enum":["absent","not_regular","oversized","unreadable","unstable"],"title":"Presence","type":"string"},"size_bytes":{"title":"Size Bytes","type":"null"}},"required":["content_digest","observed_at","path_digest","presence","size_bytes"],"title":"AbsentContentObservation","type":"object"},"ContentObservation":{"anyOf":[{"$ref":"#/$defs/PresentContentObservation"},{"$ref":"#/$defs/AbsentContentObservation"}]},"Digest":{"pattern":"^sha256:[0-9a-f]{64}$","type":"string"},"IsolationPathIdentity":{"additionalProperties":false,"description":"Canonical path-identity digests; none of them binds file bytes.","properties":{"config_path_digest":{"$ref":"#/$defs/Digest"},"endpoint_path_digest":{"$ref":"#/$defs/Digest"},"executable_path_digest":{"$ref":"#/$defs/Digest"},"state_path_digest":{"$ref":"#/$defs/Digest"},"storage_path_digest":{"$ref":"#/$defs/Digest"}},"required":["config_path_digest","endpoint_path_digest","executable_path_digest","state_path_digest","storage_path_digest"],"title":"IsolationPathIdentity","type":"object"},"ObservedAt":{"pattern":"^[0-9]{4}-[0-9]{2}-[0-9]{2}T[0-9]{2}:[0-9]{2}:[0-9]{2}\\.[0-9]{3}Z$","type":"string"},"PresentContentObservation":{"additionalProperties":false,"description":"A regular file whose bytes were read completely and stably within the bound.","properties":{"content_digest":{"$ref":"#/$defs/Digest"},"observed_at":{"$ref":"#/$defs/ObservedAt"},"path_digest":{"$ref":"#/$defs/Digest"},"presence":{"const":"present","title":"Presence","type":"string"},"size_bytes":{"maximum":16777216,"minimum":0,"title":"Size Bytes","type":"integer"}},"required":["content_digest","observed_at","path_digest","presence","size_bytes"],"title":"PresentContentObservation","type":"object"}},"$id":"https://schemas.yoetz.dev/0.1/service/isolation-report-1.0.0.schema.json","$schema":"https://json-schema.org/draft/2020-12/schema","additionalProperties":false,"description":"``yoetz.isolation-report/1``: path identity plus an optional config byte-content lane.","properties":{"binding":{"enum":["ambient","environment","environment_and_pin","runtime_pin"],"title":"Binding","type":"string"},"config_content":{"anyOf":[{"$ref":"#/$defs/ContentObservation"},{"type":"null"}]},"lifecycle":{"enum":["disposable","permanent","persistent","unlabeled"],"title":"Lifecycle","type":"string"},"mode":{"enum":["ambient","isolated"],"title":"Mode","type":"string"},"path_identity":{"$ref":"#/$defs/IsolationPathIdentity"},"schema":{"const":"yoetz.isolation-report/1","title":"Schema","type":"string"}},"required":["binding","config_content","lifecycle","mode","path_identity","schema"],"title":"isolation-report","type":"object"}