{"binding":"runtime_pin","config_content":{"content_digest":"sha256:59d5286ead5bf3f5a1a02cc72b04d73c0300b2f84c831e452aebbb9898e53987","observed_at":"2026-09-22T12:00:00.123Z","path_digest":"sha256:727b35bd214631decd33ac8057e2debfa95cb49cdca0ab51830c3733f6bcb46e","presence":"present","size_bytes":10},"lifecycle":"disposable","mode":"isolated","path_identity":{"config_path_digest":"sha256:727b35bd214631decd33ac8057e2debfa95cb49cdca0ab51830c3733f6bcb46e","endpoint_path_digest":"sha256:0b6f9c697e4533c7d7f0b04629ef457665cb9acd7c40d4536ae38de29f0d3ec2","executable_path_digest":"sha256:5fc340fb3cdb59ca9de0dee5fad8c459d63f72befdc5c81b2cf3c17abc77d200","state_path_digest":"sha256:d6ad91629ade23450d448353c26390103fa3db98921c70b0e6e70e6251beb1ea","storage_path_digest":"sha256:70874aca4e718075fd91a80c5ddacc2d980337693ce472b9d394eab321a58253"},"schema":"yoetz.isolation-report/1"}